{
  "$schema": "../../../../../schemas/catalog.schema.json",
  "blocks": {
    "kernel": {
      "quirks": {
        "linux-7-2-dcn-freeze": {
          "affected": {
            "maximumBefore": "7.3",
            "minimum": "7.2"
          },
          "enabled": true,
          "fallbackPackage": "linuxPackages_7_1"
        }
      }
    },
    "thermal": {
      "fan-control": {
        "backend": "fw-fanctrl",
        "defaultStrategy": "balanced",
        "policy": {
          "performanceStrategy": "performance",
          "quietEnterC": 60,
          "quietExitC": 68,
          "quietStrategy": "quiet",
          "thermalEnterC": 82,
          "thermalExitC": 74,
          "thermalOverrideStrategy": "max"
        },
        "strategies": {
          "balanced": {
            "fanSpeedUpdateFrequency": 8,
            "movingAverageInterval": 70,
            "speedByTemperatureC": {
              "0": 20,
              "60": 30,
              "80": 60,
              "92": 100
            }
          },
          "cooling": {
            "fanSpeedUpdateFrequency": 4,
            "movingAverageInterval": 30,
            "speedByTemperatureC": {
              "0": 50,
              "50": 65,
              "65": 80,
              "80": 100
            }
          },
          "max": {
            "fanSpeedUpdateFrequency": 2,
            "movingAverageInterval": 10,
            "speedByTemperatureC": {
              "0": 100
            }
          },
          "performance": {
            "fanSpeedUpdateFrequency": 6,
            "movingAverageInterval": 45,
            "speedByTemperatureC": {
              "0": 30,
              "55": 45,
              "70": 70,
              "82": 90,
              "90": 100
            }
          },
          "quiet": {
            "fanSpeedUpdateFrequency": 10,
            "movingAverageInterval": 90,
            "speedByTemperatureC": {
              "0": 0,
              "60": 20,
              "80": 50,
              "92": 100
            }
          }
        },
        "strategyOnDischarging": "quiet"
      }
    }
  },
  "extends": [
    "family/framework-laptop-13"
  ],
  "facts": {
    "capabilities": {
      "amdPstate": true,
      "embeddedController": "cros_ec",
      "platformProfiles": true,
      "usb4": true
    },
    "components": {
      "bluetooth": {
        "realtek-3571": {
          "bus": "usb",
          "deviceId": "13d3:3571"
        }
      },
      "fingerprint": {
        "goodix-609c": {
          "bus": "usb",
          "deviceId": "27c6:609c"
        }
      },
      "graphics": {
        "radeon-780m": {
          "bus": "pci",
          "deviceId": "1002:15bf",
          "driver": "amdgpu"
        }
      },
      "touchpad": {
        "pixart-0274": {
          "bus": "usb",
          "deviceId": "093a:0274",
          "driver": "hid-multitouch"
        }
      },
      "wifi": {
        "rtl8852be": {
          "bus": "pci",
          "deviceId": "10ec:b852",
          "driver": "rtw89_8852be"
        }
      }
    },
    "identity": {
      "productName": [
        "Laptop 13 (AMD Ryzen 7040Series)"
      ],
      "sysVendor": [
        "Framework"
      ]
    }
  },
  "id": "framework-laptop-13-amd-ryzen-7040",
  "kind": "device",
  "schemaVersion": "2.0.0",
  "sources": {
    "real-machine-2026-09-15": {
      "observedAt": "2026-09-15",
      "reference": "evidence/laptop/framework/framework-laptop-13-amd-ryzen-7040/2026-09-15.json",
      "type": "validation"
    }
  }
}
