{
  "$schema": "../../../schemas/catalog.schema.json",
  "blocks": {},
  "extends": [
    "class/laptop"
  ],
  "facts": {
    "identity": {
      "dmi": {
        "systemVendor": "HP"
      }
    },
    "secureBootFirmware": {
      "setupModeStrategy": "unsupported",
      "supported": false,
      "unsupportedReason": "HP Secure Boot ownership transfer has not been validated by GjallarOS for this device family."
    }
  },
  "id": "vendor/hp",
  "kind": "vendor",
  "schemaVersion": "2.0.0"
}
